[
  {
    "id": "SESSION-WP-001-S1",
    "package": "WP-001",
    "stage": "S1",
    "status": "CLOSED",
    "actor": "Computer authoring context",
    "context_id": "72131cdc-563c-4d43-a6b3-f37dd1253e0c",
    "independent": false,
    "commit": "846b0dcbae94b0eb268fe10571c395c90a4f1228",
    "reviewed_commit": "",
    "report": "governance/sessions/WP-001-S1.md"
  },
  {
    "id": "SESSION-WP-001-S2",
    "package": "WP-001",
    "stage": "S2",
    "status": "CLOSED",
    "actor": "Independent S2 auditor",
    "context_id": "39122e38-95a9-41a1-b210-d98ed7f9618a",
    "independent": true,
    "commit": "63bd5f8bc6e66803cd4d5a06c92b6701b1ac09f6",
    "reviewed_commit": "846b0dcbae94b0eb268fe10571c395c90a4f1228",
    "report": "governance/audits/WP-001/S2-report.md"
  },
  {
    "id": "SESSION-WP-001-S3",
    "package": "WP-001",
    "stage": "S3",
    "status": "CLOSED",
    "actor": "S3 Remediator / Independent delta review",
    "context_id": "0e8e8253-00be-41e0-9197-dc87c53d3aa1",
    "independent": false,
    "commit": "0b4dfbf54663bd129e92b2e4819eb63959326117",
    "reviewed_commit": "63bd5f8bc6e66803cd4d5a06c92b6701b1ac09f6",
    "report": "governance/execution/WP-001/S3/exit.md"
  },
  {
    "id": "SESSION-WP-001-S4",
    "package": "WP-001",
    "stage": "S4",
    "status": "IN_PROGRESS",
    "actor": "Documentation/closure owner",
    "context_id": "72128125-7e51-4832-93b2-09822b20cfb9",
    "independent": false,
    "commit": "",
    "reviewed_commit": "0b4dfbf54663bd129e92b2e4819eb63959326117",
    "report": "governance/execution/WP-001/S4/handoff.md"
  }
]
